{
  "base_commit": "d0aff8a47e92013773d9d05b2cd90fb741658b03",
  "files": [
    {
      "bytes": 6812,
      "path": "containers/sira-smoke/pragmatic/t09_freeze_commands.py",
      "sha256": "45460760c3ee12e834c995d62e2b368e3ba8c55947fc75758be4324b096b0795"
    },
    {
      "bytes": 1093152,
      "path": "containers/sira-smoke/pragmatic/t09_remote_runner.py",
      "sha256": "99319b90c2426814f67bfb3c054a284bb1b6a2ce5ac5e35bd7c24674f2363b76"
    },
    {
      "bytes": 192,
      "path": "src/giclab/control/__init__.py",
      "sha256": "b3250bf7d8c6e894cdb53903359885eeb25dd02e115a9064e614ba23a712f2b7"
    },
    {
      "bytes": 8026,
      "path": "src/giclab/control/adapters.py",
      "sha256": "a9bd1372130729cd346263d7293af0e38f86df71fa2bfb44af116e09c1e963c8"
    },
    {
      "bytes": 11485,
      "path": "src/giclab/control/agent_check.py",
      "sha256": "71a4cda7b39f0799c6bb98f06be196e1548ab24110484b4f60e298c3e41923c7"
    },
    {
      "bytes": 18683,
      "path": "src/giclab/control/anti_shadow_lint.py",
      "sha256": "08a809bce6558b586412ee04caca8d94297efd7fae47eb27f9f82a90da1107eb"
    },
    {
      "bytes": 41743,
      "path": "src/giclab/control/category3.py",
      "sha256": "4232d2d55f5b9a1f3219323ce9d9a67e72d65e3f70c47ff297f81bedd1b4312c"
    },
    {
      "bytes": 31696,
      "path": "src/giclab/control/cli.py",
      "sha256": "ca9c36aa9c88e59e2b1c20d440aee555338740784bbf529b3b92bc8a098eccaa"
    },
    {
      "bytes": 14162,
      "path": "src/giclab/control/composition.py",
      "sha256": "ea2f5ea3bae9a0a0dd241bc8a08255e84775c006f7d1bd3c59c733635726473d"
    },
    {
      "bytes": 16974,
      "path": "src/giclab/control/consumers.py",
      "sha256": "a02492bd29148fd75ae30bc45459718534187efdab9023ed7b45003dc6fbf7e6"
    },
    {
      "bytes": 2045,
      "path": "src/giclab/control/contracts.py",
      "sha256": "11091738583b1df60a4949e4aba206861549aed6412a503e0a747c5157fec7bf"
    },
    {
      "bytes": 81643,
      "path": "src/giclab/control/effects.py",
      "sha256": "481f83146fb3bacf40daebf43828cdc8f0383dcf6f818a421b70b3339fc0c8d3"
    },
    {
      "bytes": 5661,
      "path": "src/giclab/control/incidents.py",
      "sha256": "3bf68280376d4d285d605bceebe0e6ed392b8758ebd679c35273643480948a74"
    },
    {
      "bytes": 51815,
      "path": "src/giclab/control/live_conformance.py",
      "sha256": "bb1c1d097fe9c10558e0f8905302b2e7840460dd7a81e5235d5f8cb3ee21db35"
    },
    {
      "bytes": 202687,
      "path": "src/giclab/control/production.py",
      "sha256": "9eb251015dd34cc4809973df2fadb66d7b6f187a8540f8a907003083e05591e0"
    },
    {
      "bytes": 66340,
      "path": "src/giclab/control/proofs.py",
      "sha256": "de415d675e1de7f02cbcd5275d81ee95e269f43d176a8800bfc98fd4231cf800"
    },
    {
      "bytes": 17629,
      "path": "src/giclab/control/registry_validation.py",
      "sha256": "4a455c4faf78996838e8e5081bb0872e6a10e2a8ad2bff5db0afac72317733a1"
    },
    {
      "bytes": 729,
      "path": "src/giclab/control/scenarios.py",
      "sha256": "4cf66a4f0ec37bc8405777794af3d5dbbaf5feafbbb661d5d62c4aa5b1298a5c"
    },
    {
      "bytes": 16351,
      "path": "src/giclab/control/shadow.py",
      "sha256": "5a91f31eda21ed6784a1a1aecc876b943e19d48ff47ae6e1e8990c62ef5e11f8"
    },
    {
      "bytes": 88875,
      "path": "src/giclab/control/shadow_effects.py",
      "sha256": "63e4ade95c33515aa4e8abad8228c9cd8129f239ab5d4c43017792d76e9768a4"
    },
    {
      "bytes": 7917,
      "path": "src/giclab/control/state_capsule.py",
      "sha256": "3259e30ef82e0c9222d620a812ef1d369aa7836f7ac78985b51e98b1809d6906"
    },
    {
      "bytes": 23710,
      "path": "src/giclab/control/target.py",
      "sha256": "e354aa938c3f37ac56c6cd45ca672c497014ac3c09200771c23431b057e70ca7"
    },
    {
      "bytes": 12285,
      "path": "src/giclab/control/version_lint.py",
      "sha256": "2e1417b3936485bdfb201c75c32d48811f190c46469a38661f5b5db1b3f5ed26"
    },
    {
      "bytes": 13269,
      "path": "src/giclab/harness/lambda_campaign_lifecycle.py",
      "sha256": "6f0f74354f15766466480c498b4ab5af6887e337c5197416bb9dedf3ff78200b"
    },
    {
      "bytes": 93281,
      "path": "src/giclab/harness/lambda_l13_security.py",
      "sha256": "1f2736ae223649f86bb18621b008f06bf9fd0d82af6d28ed904f53e8b0111fd0"
    },
    {
      "bytes": 33515,
      "path": "src/giclab/harness/lambda_l2m_checkpoints.py",
      "sha256": "3c8ae545c4d39b633bdd9e02ae3d79a704d0eda5f0a70b0378dd3d32e6afe0f0"
    },
    {
      "bytes": 320452,
      "path": "src/giclab/harness/lambda_l2m_observer.py",
      "sha256": "3ad5d56abd2b4d115b479c9cf7f0f5202e715d07c1b4842c82dc894fbe8bf6c9"
    },
    {
      "bytes": 42587,
      "path": "src/giclab/harness/lambda_ssh_key_fingerprint.py",
      "sha256": "89570f118d9bd860b1b251fdaa9b3b28e80e5a4476ccffe6607763643967320a"
    },
    {
      "bytes": 55897,
      "path": "src/giclab/harness/sira_gate_a.py",
      "sha256": "edbda143d4a4271ad49d9b888a943192d4427395b79b14775312b27f10707c3d"
    },
    {
      "bytes": 55024,
      "path": "src/giclab/harness/t09_cleanup_state.py",
      "sha256": "39a4d698b8184c4d6652294f32e07911b2998b1a6326ad280353ba5f505e387e"
    },
    {
      "bytes": 43659,
      "path": "src/giclab/harness/t09_model_metadata_receipt.py",
      "sha256": "6ec6810ce5c0cad1d5a8fe7470c1f70d9d6449f56289f2e7edb8ff9813df404b"
    },
    {
      "bytes": 383334,
      "path": "src/giclab/harness/t09_pragmatic_provider.py",
      "sha256": "eb61bae128609ecc4d89f9e9392f647a008841387f22c4b3dd8f02402372086f"
    },
    {
      "bytes": 64903,
      "path": "src/giclab/harness/t09_provider_contracts.py",
      "sha256": "28cb11fede0136e50a3a6893ea761c779c2207da9d863f018b17b9c1eecf0665"
    },
    {
      "bytes": 155016,
      "path": "src/giclab/harness/t09_sira_pilot.py",
      "sha256": "3bd0140291744d189f696bae235db22f5a67188116ea6ae714a883b409243088"
    },
    {
      "bytes": 4099,
      "path": "src/giclab/registry.py",
      "sha256": "b71b8c979529e8530e9157069b3e765f649ee0349d8c6233d4244b98e3f658ad"
    },
    {
      "bytes": 184746,
      "path": "src/giclab/validation.py",
      "sha256": "add36cc4a54d83c14e90a9abccdc7db240db74a512f960d92cdc1f6f8cdff517"
    }
  ],
  "historical_package_changed": false,
  "live_execution_performed": false,
  "schema_version": "2.0.0",
  "scientific_contract_changed": false,
  "scope": "shared-control-plane-only",
  "semantic_sha256": "0e33677bd69cc5d988e673d29e228cefe3bff14cf46673a94c9396e9d1604d4d",
  "source_commit": "adafa96342d0c407189cd0b260cf017fb4d79f3e",
  "source_tree": "45562750df7fa3935c3b7b1af37e4c63bf244caa"
}
