{
  "base_commit": "d0aff8a47e92013773d9d05b2cd90fb741658b03",
  "files": [
    {
      "bytes": 6812,
      "path": "containers/sira-smoke/pragmatic/t09_freeze_commands.py",
      "sha256": "45460760c3ee12e834c995d62e2b368e3ba8c55947fc75758be4324b096b0795"
    },
    {
      "bytes": 1093152,
      "path": "containers/sira-smoke/pragmatic/t09_remote_runner.py",
      "sha256": "99319b90c2426814f67bfb3c054a284bb1b6a2ce5ac5e35bd7c24674f2363b76"
    },
    {
      "bytes": 192,
      "path": "src/giclab/control/__init__.py",
      "sha256": "b3250bf7d8c6e894cdb53903359885eeb25dd02e115a9064e614ba23a712f2b7"
    },
    {
      "bytes": 21242,
      "path": "src/giclab/control/adapters.py",
      "sha256": "70448b566556835cd3e774367a3e8ce7db8ba2102b46452ed43163dbedcf5b2d"
    },
    {
      "bytes": 8529,
      "path": "src/giclab/control/agent_check.py",
      "sha256": "f418d6c178e59fa10f57180bf21efec3e0ec99a603f035f5e1ee651741059337"
    },
    {
      "bytes": 36298,
      "path": "src/giclab/control/category3.py",
      "sha256": "50ec6ef80b16261f3a7afec2d786903f126c562d18b8f11f5f4c4dca6c3e5002"
    },
    {
      "bytes": 24587,
      "path": "src/giclab/control/cli.py",
      "sha256": "5df9052a3b47ad440b1fdb65edd5827e7c276411ffad2ac61126a4f2692a7e42"
    },
    {
      "bytes": 14162,
      "path": "src/giclab/control/composition.py",
      "sha256": "ea2f5ea3bae9a0a0dd241bc8a08255e84775c006f7d1bd3c59c733635726473d"
    },
    {
      "bytes": 15898,
      "path": "src/giclab/control/consumers.py",
      "sha256": "6f5e9a9a14553dee0e1e82c2299e20d998847b592d97ad7a019e8006b841c365"
    },
    {
      "bytes": 1289,
      "path": "src/giclab/control/contracts.py",
      "sha256": "52c2a6cc4602c8ad07acac8bb35dd2872c0b8cb657a827aed65a4fbd72c95674"
    },
    {
      "bytes": 5580,
      "path": "src/giclab/control/incidents.py",
      "sha256": "4339ef0b4bbc7315832988a2235f694bfda759fecf879f4c2ac9ff7752963e97"
    },
    {
      "bytes": 77074,
      "path": "src/giclab/control/production.py",
      "sha256": "83c76923367295c44068981f2e5bd63c206a71940d0eea4e900a3e05621aba06"
    },
    {
      "bytes": 44883,
      "path": "src/giclab/control/proofs.py",
      "sha256": "a46e163a671e93edf584e5a8cda5053a839ce079e897721374a854b5ac47d01c"
    },
    {
      "bytes": 17629,
      "path": "src/giclab/control/registry_validation.py",
      "sha256": "4a455c4faf78996838e8e5081bb0872e6a10e2a8ad2bff5db0afac72317733a1"
    },
    {
      "bytes": 729,
      "path": "src/giclab/control/scenarios.py",
      "sha256": "4cf66a4f0ec37bc8405777794af3d5dbbaf5feafbbb661d5d62c4aa5b1298a5c"
    },
    {
      "bytes": 15866,
      "path": "src/giclab/control/shadow.py",
      "sha256": "ff36494304312a9219386c579d9198f9098b288f6dbf58c3be0ecbc9f9ed7b67"
    },
    {
      "bytes": 5687,
      "path": "src/giclab/control/state_capsule.py",
      "sha256": "7a83c492c2869246d21ffeef854337647e5eda1f0799cacb41dc217ac884e3bf"
    },
    {
      "bytes": 14988,
      "path": "src/giclab/control/target.py",
      "sha256": "0a02087b88ef8b8c3a91402de2778af9a5f7778d98af57c7cf0d5d072410973a"
    },
    {
      "bytes": 10056,
      "path": "src/giclab/control/version_lint.py",
      "sha256": "60a6c5e0f78babdbe4768c9bcb00c8051d6512b525819edd2c846764e9eb9119"
    },
    {
      "bytes": 13269,
      "path": "src/giclab/harness/lambda_campaign_lifecycle.py",
      "sha256": "6f0f74354f15766466480c498b4ab5af6887e337c5197416bb9dedf3ff78200b"
    },
    {
      "bytes": 93281,
      "path": "src/giclab/harness/lambda_l13_security.py",
      "sha256": "1f2736ae223649f86bb18621b008f06bf9fd0d82af6d28ed904f53e8b0111fd0"
    },
    {
      "bytes": 33515,
      "path": "src/giclab/harness/lambda_l2m_checkpoints.py",
      "sha256": "3c8ae545c4d39b633bdd9e02ae3d79a704d0eda5f0a70b0378dd3d32e6afe0f0"
    },
    {
      "bytes": 320452,
      "path": "src/giclab/harness/lambda_l2m_observer.py",
      "sha256": "3ad5d56abd2b4d115b479c9cf7f0f5202e715d07c1b4842c82dc894fbe8bf6c9"
    },
    {
      "bytes": 42587,
      "path": "src/giclab/harness/lambda_ssh_key_fingerprint.py",
      "sha256": "89570f118d9bd860b1b251fdaa9b3b28e80e5a4476ccffe6607763643967320a"
    },
    {
      "bytes": 55897,
      "path": "src/giclab/harness/sira_gate_a.py",
      "sha256": "edbda143d4a4271ad49d9b888a943192d4427395b79b14775312b27f10707c3d"
    },
    {
      "bytes": 55024,
      "path": "src/giclab/harness/t09_cleanup_state.py",
      "sha256": "39a4d698b8184c4d6652294f32e07911b2998b1a6326ad280353ba5f505e387e"
    },
    {
      "bytes": 43659,
      "path": "src/giclab/harness/t09_model_metadata_receipt.py",
      "sha256": "6ec6810ce5c0cad1d5a8fe7470c1f70d9d6449f56289f2e7edb8ff9813df404b"
    },
    {
      "bytes": 383334,
      "path": "src/giclab/harness/t09_pragmatic_provider.py",
      "sha256": "eb61bae128609ecc4d89f9e9392f647a008841387f22c4b3dd8f02402372086f"
    },
    {
      "bytes": 63321,
      "path": "src/giclab/harness/t09_provider_contracts.py",
      "sha256": "8356870290fefa6ee680ca6d8d5a080b146fcd5215eb1ad0fbc47b62d401c07f"
    },
    {
      "bytes": 150214,
      "path": "src/giclab/harness/t09_sira_pilot.py",
      "sha256": "ddfb499a788650e56ad320dc464253aa5e12fa5767e90b76982ff8afa1c39e84"
    },
    {
      "bytes": 4099,
      "path": "src/giclab/registry.py",
      "sha256": "b71b8c979529e8530e9157069b3e765f649ee0349d8c6233d4244b98e3f658ad"
    },
    {
      "bytes": 188736,
      "path": "src/giclab/validation.py",
      "sha256": "1166e3eb8da05a53bce2cf040acf92d321141a03105819eea89a4aec02625e46"
    }
  ],
  "historical_package_changed": false,
  "live_execution_performed": false,
  "schema_version": "1.0.0",
  "scientific_contract_changed": false,
  "scope": "shared-control-plane-only",
  "semantic_sha256": "51a72cd6bd8f38d90c12a09f118ac2e53615270fc370d63ba343e7df5a2e52ad",
  "source_commit": "c6f0d7af1f10b2b8b110d8225b2c54c1d2709fbd",
  "source_tree": "04926d20fd7743a1f3433b3fb1cb9b27e23582d1"
}
